{
  "schema": "agoragentic.agent-os.harness.v1",
  "schema_artifacts": {
    "agent_os_harness": "https://agoragentic.com/schema/agent-os-harness.v1.json",
    "micro_ecf_policy": "https://agoragentic.com/schema/micro-ecf-policy.v1.json"
  },
  "agent_manifest": {
    "name": "Support Triage Agent",
    "framework": "openai-agents",
    "primary_goal": "Summarize support issues and draft safe ticket responses",
    "runtime_shape": "self_hosted_http"
  },
  "context_policy": {
    "allowed_sources": ["approved_knowledge_base", "ticket_metadata", "public_docs"],
    "denied_sources": ["payment_cards", "raw_passwords", "private_inbox_without_approval"],
    "retention": "ticket_summary_only_after_review",
    "redaction": "pii_minimized"
  },
  "tool_policy": {
    "allowed_tools": ["knowledge_search", "ticket_create", "marketplace_execute"],
    "denied_tools": ["refund_issue", "account_delete", "external_send_without_review"],
    "side_effects": "approval_required"
  },
  "budget_policy": {
    "treasury_required": true,
    "max_daily_spend_usdc": 8,
    "approval_required_above_usdc": 2,
    "recommended_start_reserve_usdc": 25
  },
  "approval_policy": {
    "autonomous": ["read", "draft", "classify", "quote_preview"],
    "human_gated": ["external_send", "refund_issue", "raise_budget"]
  },
  "memory_policy": {
    "write_gate": "after_resolution_and_review",
    "secret_storage": "reference_only"
  },
  "swarm_policy": {
    "max_agents": 2,
    "delegation": "support_escalation_only"
  },
  "deployment_policy": {
    "hosting_target": "self_hosted_http",
    "exposure_mode": "private_only",
    "first_proof_required": true,
    "source": {
      "type": "repository",
      "ref": "https://github.com/example/support-triage-agent"
    }
  },
  "public_boundary": {
    "no_spend_export": true,
    "hosted_billing": false,
    "cloud_provisioning": false,
    "marketplace_publication": false,
    "hosted_runtime_secrets": false
  },
  "agent_os_export": {
    "catalog_endpoint": "GET /api/hosting/agent-os/catalog",
    "preview_endpoint": "POST /api/hosting/agent-os/preview",
    "deployment_endpoint": "POST /api/hosting/agent-os/deployments",
    "treasury_endpoint": "GET /api/hosting/agent-os/deployments/{deployment_id}/treasury",
    "workspace_surface": "/agent-os/workspaces/",
    "marketplace_router": "POST /api/execute",
    "x402_edge": "POST https://x402.agoragentic.com/v1/{slug}"
  },
  "agent_os_preview_request": {
    "name": "Support Triage Agent",
    "hosting_target": "self_hosted_http",
    "template_id": "self_hosted_router_advocate",
    "runtime_lane": "customer_managed_http_runtime",
    "exposure_mode": "private_only",
    "source": {
      "type": "repository",
      "ref": "https://github.com/example/support-triage-agent"
    },
    "goals": {
      "primary_goal": "Summarize support issues and draft safe ticket responses",
      "budget": {
        "max_daily_usdc": 8,
        "approval_required_above_usdc": 2,
        "recommended_start_reserve_usdc": 25
      }
    },
    "safety_policy": {
      "first_proof_required": true,
      "context_policy": {
        "allowed_sources": ["approved_knowledge_base", "ticket_metadata", "public_docs"],
        "denied_sources": ["payment_cards", "raw_passwords", "private_inbox_without_approval"]
      },
      "tool_policy": {
        "allowed_tools": ["knowledge_search", "ticket_create", "marketplace_execute"],
        "denied_tools": ["refund_issue", "account_delete", "external_send_without_review"]
      },
      "approval_policy": {
        "autonomous": ["read", "draft", "classify", "quote_preview"],
        "human_gated": ["external_send", "refund_issue", "raise_budget"]
      },
      "memory_policy": {
        "write_gate": "after_resolution_and_review",
        "secret_storage": "reference_only"
      },
      "swarm_policy": {
        "max_agents": 2,
        "delegation": "support_escalation_only"
      }
    },
    "deployment_packet": {
      "schema": "agoragentic.micro-ecf.export.v1",
      "source": "public_micro_ecf",
      "harness_schema": "agoragentic.agent-os.harness.v1"
    }
  }
}
